{
    "_note": [
        "# Attacker Lesson 7: Wireless Sniffing",
        "## Summary",
        "Everything on the lab network travels over Wi-Fi, and Wi-Fi is a shared medium: anyone in range can listen. In this lesson you join the lab network and capture its traffic passively, without sending a single packet of your own.",
        "## Objectives",
        "- Connect to the lab AP with the WiFi form.\n- Start a passive capture with the Sniff form.\n- Use the IP source and destination columns to tell conversations apart.\n- Explain what an eavesdropper can learn without ever being detected.",
        "## Reading",
        "*Securing Cyber-Physical Systems: A Hands-On Guide*, Chapter 4: Wireless Networks, Commas, and \"Quotes\"",
        "## Where This Fits",
        "**Previous:** Attacker Lesson 2, *Network Recon*."
    ],

    "schema_version": 1,
    "link_label": "title_buttons_workspace_wireless_sniffing",
    "include": 1,
    "category": "attacker",
    "order": 8,
    "prerequisites": ["workspaces/network_recon"],
    "estimated_minutes": 25,
    "gradable": true,

    "build_type": "workspace",

    "settings": {
        "available": {"wifi": 1, "sniff": 1},
        "network_action_forms_shown": {"wifi": 1, "sniff": 1},
        "packet_columns": {
            "time_word": 1,
            "number": 1,
            "observer": 1,
            "direction": 1,
            "protocol": 1,
            "modbus_word": 1,
            "ip_src": 1,
            "ip_dst": 1
        },
        "network_action_form_inputs": {"wifi": ["AP-Config"]}
    },

    "title": "wireless_sniffing_workspace",
    "menu_bar": [
        "model_style_button",
        "strip_chart_style_button",
        "clear_inputs_button",
        "reset_layout_button",
        "reset_button",
        "preset_button",
        "network_forms_button",
        "modbus_forms_button",
        "defender_forms_button",
        "packet_columns_button",
        "ap_config_button"
    ],

    "layout_shape": {
        "h_panes_1": [
            "network_action_panel_1",
            {"v_panes_1": ["packet_panel_1", "status_panel_1"]},
            "network_graph_panel_1"
        ]
    },
    "layout_weights": {
        "network_action_panel_1": 2,
        "v_panes_1": 4,
        "packet_panel_1": 3,
        "status_panel_1": 1,
        "network_graph_panel_1": 3
    }
}
