{
    "_note": [
        "# Docking: One Pane",
        "## Summary",
        "Every panel stacked as tabs in a single pane - more tabs than fit, so the ones there's no room for are behind the ··· button.",
        "## Try This",
        "- Open the ··· button and pick a tab from it.\n- Drag panels out of the stack, one by one, onto the edges of the pane, until you've built a layout you like.\n- Then stack some back up again.",
        "## How Docking Works",
        "**Moving a panel:** press its title bar - the empty space, the title, or a tab - and drag. The panel stays put, faded, while a chip with its name follows the mouse and a see-through rectangle shows where it'll land - nothing moves until you let go.",
        "- **The middle of a pane:** the panel joins it as a tab.\n- **Near one of a pane's edges:** the pane splits, and the panel takes that half.\n- **A tab row:** the panel goes in as a tab, right where the marker is.\n- **The very edge of a group of panes:** a thin band along it docks the panel beside the whole group - near the window's edges, beside everything.\n- **Anywhere else, or Esc:** the panel goes back where it was.",
        "**Minimizing:** the bar at the left of a title bar minimizes that pane to just its title, giving its room to the panes beside it; the square it turns into brings it back to its size. Minimize every pane in a column (or row) and the whole column lays flat the other way, its titles turned sideways. Dragging a divider until a pane is just its title bar minimizes it too - and dragging one until a whole column (or row) is that thin lays the column flat. Click a minimized pane's title to peek at it in a popup - use it there, and click away to put it back.",
        "Your layout is saved with the workspace, like your inputs. **Reset Layout** (under **Edit Workspace**) puts every panel back where it started."
    ],

    "_dev_note": "A demo of docking (see widgets/frame_widgets/docking.py) - no lesson, just a layout to rearrange.",

    "schema_version": 1,
    "link_label": "title_buttons_workspace_docking_one_pane",
    "include": 1,
    "category": "docking_demo",
    "order": 3,
    "prerequisites": [],
    "estimated_minutes": 5,
    "gradable": false,

    "build_type": "workspace",

    "settings": {
        "available": {"sniff": 1, "wifi": 1, "nmap": 1, "arp": 1},
        "network_action_forms_shown": {"wifi": 1, "arp": 1, "sniff": 1, "nmap": 1},
        "packet_columns": {
            "time_word": 1,
            "number": 1,
            "observer": 1,
            "direction": 1,
            "protocol": 1,
            "modbus_word": 1
        }
    },

    "title": "docking_one_pane_workspace",
    "menu_bar": [],

    "layout_shape": {
        "h_panes_1": [
            {
                "tabs_1": [
                    "packet_panel_1",
                    "network_action_panel_1",
                    "network_graph_panel_1",
                    "status_panel_1",
                    "modbus_table_panel_1",
                    "modbus_chart_panel_1"
                ]
            }
        ]
    },
    "layout_weights": {}
}
